{
  "version": "1.0",
  "created_at": "2026-03-06T00:26:31.097071",
  "total_tables": 150,
  "tables_from_repo": 150,
  "tables_generated": 0,
  "tables": [
    {
      "id": "table_repo_001",
      "path": "tables/from_repo/literature_evidence_21.csv",
      "source": "from_repo",
      "priority": 1,
      "original_path": "example/literature_evidence.csv",
      "recommended_sections": [
        "results"
      ],
      "default_caption": "Literature evidence",
      "generating_script": null
    },
    {
      "id": "table_repo_002",
      "path": "tables/from_repo/literature_evidence_22.csv",
      "source": "from_repo",
      "priority": 1,
      "original_path": "manuscript/MicroGrowAgents_v7/literature_evidence.csv",
      "recommended_sections": [
        "results"
      ],
      "default_caption": "Literature evidence",
      "generating_script": null
    },
    {
      "id": "table_repo_003",
      "path": "tables/from_repo/literature_evidence_23.csv",
      "source": "from_repo",
      "priority": 1,
      "original_path": "manuscript/microgrowagents_v1/literature_evidence.csv",
      "recommended_sections": [
        "results"
      ],
      "default_caption": "Literature evidence",
      "generating_script": null
    },
    {
      "id": "table_repo_004",
      "path": "tables/from_repo/literature_evidence_24.csv",
      "source": "from_repo",
      "priority": 1,
      "original_path": "manuscript/MicroGrowAgents_v6/literature_evidence.csv",
      "recommended_sections": [
        "results"
      ],
      "default_caption": "Literature evidence",
      "generating_script": null
    },
    {
      "id": "table_repo_005",
      "path": "tables/from_repo/literature_evidence_1_2.csv",
      "source": "from_repo",
      "priority": 1,
      "original_path": "manuscript/MicroGrowAgents_v6/literature_evidence_1.csv",
      "recommended_sections": [
        "results"
      ],
      "default_caption": "Literature evidence 1",
      "generating_script": null
    },
    {
      "id": "table_repo_006",
      "path": "tables/from_repo/literature_evidence_2_2.csv",
      "source": "from_repo",
      "priority": 1,
      "original_path": "manuscript/MicroGrowAgents_v6/literature_evidence_2.csv",
      "recommended_sections": [
        "results"
      ],
      "default_caption": "Literature evidence 2",
      "generating_script": null
    },
    {
      "id": "table_repo_007",
      "path": "tables/from_repo/literature_evidence_3_2.csv",
      "source": "from_repo",
      "priority": 1,
      "original_path": "manuscript/MicroGrowAgents_v6/literature_evidence_3.csv",
      "recommended_sections": [
        "results"
      ],
      "default_caption": "Literature evidence 3",
      "generating_script": null
    },
    {
      "id": "table_repo_008",
      "path": "tables/from_repo/literature_evidence_7_1.csv",
      "source": "from_repo",
      "priority": 1,
      "original_path": "manuscript/MicroGrowAgents_v6/literature_evidence_7.csv",
      "recommended_sections": [
        "results"
      ],
      "default_caption": "Literature evidence 7",
      "generating_script": null
    },
    {
      "id": "table_repo_009",
      "path": "tables/from_repo/literature_evidence_6_1.csv",
      "source": "from_repo",
      "priority": 1,
      "original_path": "manuscript/MicroGrowAgents_v6/literature_evidence_6.csv",
      "recommended_sections": [
        "results"
      ],
      "default_caption": "Literature evidence 6",
      "generating_script": null
    },
    {
      "id": "table_repo_010",
      "path": "tables/from_repo/literature_evidence_4_1.csv",
      "source": "from_repo",
      "priority": 1,
      "original_path": "manuscript/MicroGrowAgents_v6/literature_evidence_4.csv",
      "recommended_sections": [
        "results"
      ],
      "default_caption": "Literature evidence 4",
      "generating_script": null
    },
    {
      "id": "table_repo_011",
      "path": "tables/from_repo/literature_evidence_5_1.csv",
      "source": "from_repo",
      "priority": 1,
      "original_path": "manuscript/MicroGrowAgents_v6/literature_evidence_5.csv",
      "recommended_sections": [
        "results"
      ],
      "default_caption": "Literature evidence 5",
      "generating_script": null
    },
    {
      "id": "table_repo_012",
      "path": "tables/from_repo/literature_evidence_10_1.csv",
      "source": "from_repo",
      "priority": 1,
      "original_path": "manuscript/MicroGrowAgents_v6/literature_evidence_10.csv",
      "recommended_sections": [
        "results"
      ],
      "default_caption": "Literature evidence 10",
      "generating_script": null
    },
    {
      "id": "table_repo_013",
      "path": "tables/from_repo/literature_evidence_8_1.csv",
      "source": "from_repo",
      "priority": 1,
      "original_path": "manuscript/MicroGrowAgents_v6/literature_evidence_8.csv",
      "recommended_sections": [
        "results"
      ],
      "default_caption": "Literature evidence 8",
      "generating_script": null
    },
    {
      "id": "table_repo_014",
      "path": "tables/from_repo/literature_evidence_9_1.csv",
      "source": "from_repo",
      "priority": 1,
      "original_path": "manuscript/MicroGrowAgents_v6/literature_evidence_9.csv",
      "recommended_sections": [
        "results"
      ],
      "default_caption": "Literature evidence 9",
      "generating_script": null
    },
    {
      "id": "table_repo_015",
      "path": "tables/from_repo/literature_evidence_25.csv",
      "source": "from_repo",
      "priority": 1,
      "original_path": "manuscript/MicroGrowLink_v1/literature_evidence.csv",
      "recommended_sections": [
        "results"
      ],
      "default_caption": "Literature evidence",
      "generating_script": null
    },
    {
      "id": "table_repo_016",
      "path": "tables/from_repo/literature_evidence_26.csv",
      "source": "from_repo",
      "priority": 1,
      "original_path": "manuscript/roastchip_v4/literature_evidence.csv",
      "recommended_sections": [
        "results"
      ],
      "default_caption": "Literature evidence",
      "generating_script": null
    },
    {
      "id": "table_repo_017",
      "path": "tables/from_repo/literature_evidence_27.csv",
      "source": "from_repo",
      "priority": 1,
      "original_path": "manuscript/roastchip_v3/literature_evidence.csv",
      "recommended_sections": [
        "results"
      ],
      "default_caption": "Literature evidence",
      "generating_script": null
    },
    {
      "id": "table_repo_018",
      "path": "tables/from_repo/literature_evidence_28.csv",
      "source": "from_repo",
      "priority": 1,
      "original_path": "manuscript/microgrowagents_v3/literature_evidence.csv",
      "recommended_sections": [
        "results"
      ],
      "default_caption": "Literature evidence",
      "generating_script": null
    },
    {
      "id": "table_repo_019",
      "path": "tables/from_repo/literature_evidence_29.csv",
      "source": "from_repo",
      "priority": 1,
      "original_path": "manuscript/MicroGrowAgents_v4/literature_evidence.csv",
      "recommended_sections": [
        "results"
      ],
      "default_caption": "Literature evidence",
      "generating_script": null
    },
    {
      "id": "table_repo_020",
      "path": "tables/from_repo/literature_evidence_imported_2.csv",
      "source": "from_repo",
      "priority": 1,
      "original_path": "manuscript/MicroGrowAgents_v4/literature_evidence_imported.csv",
      "recommended_sections": [
        "results"
      ],
      "default_caption": "Literature evidence imported",
      "generating_script": null
    },
    {
      "id": "table_repo_021",
      "path": "tables/from_repo/literature_evidence_new_2.csv",
      "source": "from_repo",
      "priority": 1,
      "original_path": "manuscript/MicroGrowAgents_v4/literature_evidence_new.csv",
      "recommended_sections": [
        "results"
      ],
      "default_caption": "Literature evidence new",
      "generating_script": null
    },
    {
      "id": "table_repo_022",
      "path": "tables/from_repo/literature_evidence_30.csv",
      "source": "from_repo",
      "priority": 1,
      "original_path": "manuscript/roastchip_v2/literature_evidence.csv",
      "recommended_sections": [
        "results"
      ],
      "default_caption": "Literature evidence",
      "generating_script": null
    },
    {
      "id": "table_repo_023",
      "path": "tables/from_repo/literature_evidence_31.csv",
      "source": "from_repo",
      "priority": 1,
      "original_path": "manuscript/microgrowagents_v2/literature_evidence.csv",
      "recommended_sections": [
        "results"
      ],
      "default_caption": "Literature evidence",
      "generating_script": null
    },
    {
      "id": "table_repo_024",
      "path": "tables/from_repo/literature_evidence_validation_1.csv",
      "source": "from_repo",
      "priority": 1,
      "original_path": "manuscript/microgrowagents_v2/literature_evidence_validation.csv",
      "recommended_sections": [
        "results"
      ],
      "default_caption": "Literature evidence validation",
      "generating_script": null
    },
    {
      "id": "table_repo_025",
      "path": "tables/from_repo/literature_evidence_imported_3.csv",
      "source": "from_repo",
      "priority": 1,
      "original_path": "manuscript/microgrowagents_v2/literature_evidence_imported.csv",
      "recommended_sections": [
        "results"
      ],
      "default_caption": "Literature evidence imported",
      "generating_script": null
    },
    {
      "id": "table_repo_026",
      "path": "tables/from_repo/literature_evidence_new_3.csv",
      "source": "from_repo",
      "priority": 1,
      "original_path": "manuscript/microgrowagents_v2/literature_evidence_new.csv",
      "recommended_sections": [
        "results"
      ],
      "default_caption": "Literature evidence new",
      "generating_script": null
    },
    {